{
  "settingId": "spuk_im_schlosskeller",
  "hinweis": "Gegenstände und Indizien. Lage = wo der Gegenstand während der Ermittlungsrunden ist; sie ist in allen Pfaden gleich (Regel K-1), außer beim versteckten Schlüsselbund. Jede Spur nennt, in welchem Pfad sie entsteht (entstehtWenn), was sie dort zeigt und was in den anderen Pfaden zu sehen ist (harmlos). Der Beweistest prüft entstehtWenn gegen die Tatmatrix. Der Schlüsselbund ist nie ein Kartenmarker; seine vier möglichen Verstecke (Jacke, Brottasche, Eiskübel, Rüstungshelm) gibt es in allen Pfaden als gleiche Untersuchungsziele.",
  "gegenstaende": [
    {
      "id": "kerzenstaender",
      "name": "Messingkerzenständer",
      "beschreibung": "Schwerer Kerzenständer aus Messing für drei rote Wachskerzen. Herr Schneider hat ihn selbst poliert.",
      "lage": {
        "ort": "vor_vorratstuer",
        "stelle": "umgestoßen auf dem Steinboden vor der Vorratsraumtür; Tugba hat verboten, ihn anzufassen"
      },
      "sichtbar": true,
      "spuren": [
        {
          "id": "spur_staender_verbogen",
          "stelle": "Schaft",
          "entstehtWenn": {
            "immer": true
          },
          "zeigt": "Der Schaft ist leicht verbogen, die drei roten Kerzen liegen daneben am Boden.",
          "rolle": {
            "alle": "umgebung"
          }
        },
        {
          "id": "spur_griff_leuchtfarbe",
          "stelle": "Griff",
          "entstehtWenn": {
            "kerzenstaenderGegriffenVon": "can"
          },
          "zeigt": "Um den Griff liegt der Abdruck einer ganzen Hand in grünlich-weißer Leuchtfarbe, derselben Farbe wie auf der Maske.",
          "harmlos": "Der Griff ist blank poliert, ohne Farbe.",
          "rolle": {
            "can": "schluesselbeweis"
          }
        },
        {
          "id": "spur_fuss_splitter",
          "stelle": "Fuß",
          "entstehtWenn": {
            "kerzenstaenderGegriffenVon": "olli"
          },
          "zeigt": "Im roten Wachs am Fuß, das inzwischen erstarrt ist, kleben feine Holzsplitter und weißer Kalk.",
          "harmlos": "Am Fuß klebt nur rotes Wachs.",
          "rolle": {
            "olli": "schluesselbeweis"
          }
        }
      ]
    },
    {
      "id": "silberring_fatma",
      "name": "Fatmas breiter Silberring",
      "beschreibung": "Ein breiter, glatter Silberring an Fatmas rechter Hand.",
      "lage": {
        "traeger": "fatma"
      },
      "sichtbar": false,
      "spuren": [
        {
          "id": "spur_ring_messing",
          "stelle": "Außenseite",
          "entstehtWenn": {
            "kerzenstaenderGegriffenVon": "fatma"
          },
          "zeigt": "Frischer goldgelber Messingabrieb in einer Kerbe des Rings.",
          "harmlos": "Nur feine Kratzer von der Glasscheibe der Vitrine, kein Messing.",
          "rolle": {
            "fatma": "schluesselbeweis"
          }
        }
      ]
    },
    {
      "id": "jacke_ahmet",
      "name": "Ahmets schwarze Stoffjacke",
      "beschreibung": "Ahmets Jacke hängt seit 23:55 am vordersten Haken des Jackenständers im Ost-Saal.",
      "lage": {
        "einrichtung": "jackenstaender",
        "ort": "am_jackenstaender",
        "stelle": "vorderster Haken"
      },
      "sichtbar": true,
      "spuren": [
        {
          "id": "spur_jacke_namensliste",
          "stelle": "Brusttasche",
          "entstehtWenn": {
            "immer": true
          },
          "zeigt": "Eine Liste mit allen Namen der Gäste, hinter jedem „150 € ✓“.",
          "rolle": {
            "alle": "nebendelikt"
          },
          "nebendelikt": "nd_mietgeld"
        },
        {
          "id": "spur_jacke_bund",
          "stelle": "Innentasche",
          "entstehtWenn": {
            "bundEndetBei": "jackenstaender"
          },
          "zeigt": "In der Innentasche steckt Herrn Schneiders großer Schlüsselbund.",
          "harmlos": "Die Innentasche ist leer bis auf ein Kaugummipapier.",
          "rolle": {
            "ahmet": "schluesselbeweis"
          }
        }
      ]
    },
    {
      "id": "umschlag_mietgeld",
      "name": "Umschlag mit dem Mietgeld",
      "beschreibung": "Ein brauner Umschlag mit Ahmets Handschrift: „Miete Schlosskeller“. Gegen 0:12 leert Ahmet ihn und wirft ihn in den Ascheneimer am Kamin.",
      "lage": {
        "einrichtung": "ascheneimer",
        "ort": "am_kamin",
        "stelle": "leer im Ascheneimer neben der Kamin-Nische"
      },
      "sichtbar": true,
      "spuren": [
        {
          "id": "spur_umschlag_aufschrift",
          "stelle": "Vorderseite",
          "entstehtWenn": {
            "immer": true
          },
          "zeigt": "„Miete Schlosskeller“ in Ahmets Handschrift. Der Umschlag ist leer.",
          "rolle": {
            "alle": "nebendelikt"
          },
          "nebendelikt": "nd_mietgeld"
        },
        {
          "id": "spur_umschlag_wachs",
          "stelle": "Rückseite",
          "entstehtWenn": {
            "kerzenstaenderGegriffenVon": "ahmet"
          },
          "zeigt": "Drei erstarrte rote Wachstropfen.",
          "harmlos": "Kein Wachs, nur ein Knick.",
          "rolle": {
            "ahmet": "zusatzindiz"
          }
        }
      ]
    },
    {
      "id": "muenzschatulle",
      "name": "Münzschatulle aus der Turmvitrine",
      "beschreibung": "Kleine schwere Holzschatulle mit alten Schlossmünzen, Reliefs auf dem Deckel.",
      "lage": {
        "traeger": "fatma",
        "stelle": "in Fatmas Umhängetasche"
      },
      "sichtbar": false,
      "spuren": [
        {
          "id": "spur_schatulle_da",
          "stelle": "Tasche",
          "entstehtWenn": {
            "immer": true
          },
          "zeigt": "Die Schatulle aus der Vitrine liegt in Fatmas Tasche, zwischen Skizzenblock und Stiften.",
          "rolle": {
            "alle": "nebendelikt"
          },
          "nebendelikt": "nd_schatulle",
          "widerlegt": [
            "luege_fatma_tasche"
          ]
        },
        {
          "id": "spur_schatulle_wachs",
          "stelle": "Deckel",
          "entstehtWenn": {
            "kerzenstaenderGegriffenVon": "fatma"
          },
          "zeigt": "Auf dem Deckel kleben rote Wachstropfen.",
          "harmlos": "Der Deckel ist sauber.",
          "rolle": {
            "fatma": "zusatzindiz"
          }
        }
      ]
    },
    {
      "id": "leuchtmaske",
      "name": "Leuchtmaske",
      "beschreibung": "Weiße Gespenstermaske aus Kunststoff, am Nachmittag mit nachleuchtender Farbe bemalt.",
      "lage": {
        "traeger": "can",
        "stelle": "in der Bauchtasche von Cans Pulli"
      },
      "sichtbar": false,
      "spuren": [
        {
          "id": "spur_maske_da",
          "stelle": "Bauchtasche",
          "entstehtWenn": {
            "immer": true
          },
          "zeigt": "Die Maske steckt zusammengefaltet in Cans Bauchtasche. Die Farbe ist noch leicht klebrig.",
          "rolle": {
            "alle": "nebendelikt"
          },
          "nebendelikt": "nd_streich",
          "widerlegt": [
            "luege_can_maske"
          ]
        },
        {
          "id": "spur_maske_wachs",
          "stelle": "Stirn der Maske",
          "entstehtWenn": {
            "kerzenstaenderGegriffenVon": "can"
          },
          "zeigt": "Rote Wachstropfen auf der Stirn der Maske.",
          "harmlos": "Kein Wachs, nur Leuchtfarbe.",
          "rolle": {
            "can": "zusatzindiz"
          }
        }
      ]
    },
    {
      "id": "bund_schneider",
      "name": "Herrn Schneiders Schlüsselbund",
      "beschreibung": "Großer Bund mit dem Schlüssel für das Außentor, die Hoftür und den Turm.",
      "lage": {
        "versteckt": true
      },
      "sichtbar": false,
      "versteckJePfad": {
        "ahmet": {
          "einrichtung": "jackenstaender",
          "ort": "am_jackenstaender",
          "stelle": "in der Innentasche von Ahmets Jacke"
        },
        "fatma": {
          "einrichtung": "linkes_buffet_13",
          "ort": "hinter_linkem_buffet",
          "stelle": "in der Brottasche auf dem linken Buffettisch"
        },
        "olli": {
          "ort": "am_eiskuebel",
          "stelle": "unter dem Eis im Eiskübel"
        },
        "can": {
          "ort": "an_der_ruestung",
          "stelle": "im Helm der Ritterrüstung"
        }
      }
    },
    {
      "id": "eiskuebel",
      "name": "Eiskübel",
      "beschreibung": "Metallkübel mit Eiswürfeln am Ostende der Theke.",
      "lage": {
        "ort": "am_eiskuebel"
      },
      "sichtbar": true,
      "spuren": [
        {
          "id": "spur_eiskuebel_bund",
          "stelle": "unter dem Eis",
          "entstehtWenn": {
            "bundEndetBei": "am_eiskuebel"
          },
          "zeigt": "Unter den Eiswürfeln liegt Herrn Schneiders Schlüsselbund.",
          "harmlos": "Nur Eis und Schmelzwasser.",
          "rolle": {
            "olli": "zusatzindiz"
          }
        }
      ]
    },
    {
      "id": "brottasche",
      "name": "Brottasche",
      "beschreibung": "Leinentasche mit Fladenbrot und Baguette auf dem linken Buffettisch.",
      "lage": {
        "einrichtung": "linkes_buffet_13",
        "ort": "hinter_linkem_buffet"
      },
      "sichtbar": true,
      "spuren": [
        {
          "id": "spur_brottasche_bund",
          "stelle": "unter dem Brot",
          "entstehtWenn": {
            "bundEndetBei": "linkes_buffet_13"
          },
          "zeigt": "Unter dem Brot liegt Herrn Schneiders Schlüsselbund.",
          "harmlos": "Nur Brot und Krümel.",
          "rolle": {
            "fatma": "fundort"
          }
        }
      ]
    },
    {
      "id": "ruestungshelm",
      "name": "Helm der Ritterrüstung",
      "beschreibung": "Der Helm der alten Ritterrüstung im Turmgang, das Visier klemmt.",
      "lage": {
        "einrichtung": "ruestung",
        "ort": "an_der_ruestung"
      },